{
  "$schema": "../sequence-spec.schema.json",
  "kind": "sequence",
  "title": "Knowledge accepted project facts",
  "alt": "Project-wide Knowledge search requires an unbound project token, checks current authority and existing run-provider pins, searches all agents without creating pins, and orders results globally before paging. Each result's accessRunId names the existing run binding used for history authorization; record sourceRunId is separate provenance. Knowledge commits an accepted proposal, revisions, immutable redacted receipt, and delivery intent together through the selected Memory provider: native PostgreSQL by default or an existing Cosmos container or Redis primary. Current relay requests include project/run scope and Events reads from the pinned provider; the original three-field N-1 request uses the legacy unscoped native PostgreSQL receipt route. Partial scope is rejected and scoped reads never fall back. Events appends a separate project fact with sequence, inbox dedupe, and durable acknowledgment. The Knowledge run pin and Sessions journal remain in PostgreSQL. Separate record update, archive, supersession, restore, approval, and versioned transfer operations preserve immutable history; imported records return Active with Pending trust.",
  "autonumber": true,
  "participants": [
    {
      "id": "knowledge",
      "label": "Knowledge\nHTTP service",
      "subLabel": "Receipt and local outbox",
      "icon": "server",
      "fluentIcon": "api",
      "badge": {
        "text": "service",
        "tone": "teal"
      }
    },
    {
      "id": "database",
      "label": "Selected Memory\nprovider",
      "subLabel": "PostgreSQL default or pinned Cosmos/Redis",
      "icon": "database",
      "fluentIcon": "state",
      "badge": {
        "text": "provider-owned",
        "tone": "green"
      }
    },
    {
      "id": "events",
      "label": "Events & Sessions\nproject-fact API",
      "subLabel": "Trusted receipt and current auth",
      "icon": "server",
      "fluentIcon": "api",
      "badge": {
        "text": "native owner",
        "tone": "teal"
      }
    },
    {
      "id": "eventDatabase",
      "label": "Events PostgreSQL\nproject fact stream",
      "subLabel": "Sequence, fact, inbox, ack",
      "icon": "database",
      "fluentIcon": "state",
      "badge": {
        "text": "durable authority",
        "tone": "green"
      }
    }
  ],
  "steps": [
    {
      "type": "note",
      "over": ["knowledge", "database"],
      "label": "Caller bearer stays in memory. Check exact agent owner, source run, pending state, expected revisions, and fresh effective AccessPrivateKnowledge."
    },
    {
      "type": "note",
      "over": ["knowledge", "database"],
      "label": "Cosmos batch: 100 ops, 2 MB, 5 s; project partition: 20 GB and 10,000 RU/s. 408/413/429 fail closed; tests do not claim live throughput."
    },
    {
      "type": "note",
      "over": ["knowledge", "database"],
      "label": "Redis candidate: TLS, AOF-always standalone primary; noeviction, no replicas/cluster, persistent keys; validated Lua batch writes once."
    },
    {
      "type": "note",
      "over": ["knowledge", "database"],
      "label": "Original six-capability selections retain their immutable pin; a missing existing-run pin still returns 503."
    },
    {
      "type": "note",
      "over": ["knowledge", "database"],
      "label": "Project search merges existing pins in one global order before paging."
    },
    {
      "type": "message",
      "from": "knowledge",
      "to": "database",
      "label": "One provider transaction: promote record; create decision/revisions, redacted receipt, delivery intent, idempotency result",
      "line": "solid",
      "arrow": "filled"
    },
    {
      "type": "message",
      "from": "database",
      "to": "knowledge",
      "label": "Commit; return stable receipt ID",
      "line": "dashed",
      "arrow": "open"
    },
    {
      "type": "message",
      "from": "knowledge",
      "to": "events",
      "label": "POST accepted-effects: receipt ID, versions and paired project/run scope; original N-1 request omits both",
      "line": "solid",
      "arrow": "filled"
    },
    {
      "type": "message",
      "from": "events",
      "to": "knowledge",
      "label": "GET scoped pinned-Memory route for current request; legacy N-1 uses unscoped native-PostgreSQL route; redirects disabled",
      "line": "solid",
      "arrow": "filled"
    },
    {
      "type": "note",
      "over": ["knowledge", "events"],
      "label": "Both routes verify caller bounds and fresh WriteProjects; responses are no-store. Partial scope is invalid; scoped reads never fall back."
    },
    {
      "type": "note",
      "over": ["knowledge", "events"],
      "label": "Knowledge promotion requires AccessPrivateKnowledge; Events separately requires WriteProjects, so delivery may remain PENDING."
    },
    {
      "type": "message",
      "from": "knowledge",
      "to": "events",
      "label": "Committed immutable receipt; never forward proposal content",
      "line": "dashed",
      "arrow": "open"
    },
    {
      "type": "note",
      "over": ["events", "eventDatabase"],
      "label": "Events rechecks receipt actor and project/run bounds against the same caller, rejects purpose tokens, and fetches fresh WriteProjects."
    },
    {
      "type": "message",
      "from": "events",
      "to": "eventDatabase",
      "label": "One transaction: derive project fact, assign sequence, dedupe inbox ID, persist exact ack",
      "line": "solid",
      "arrow": "filled"
    },
    {
      "type": "message",
      "from": "eventDatabase",
      "to": "events",
      "label": "Commit; return receipt-bound acknowledgment",
      "line": "dashed",
      "arrow": "open"
    },
    {
      "type": "message",
      "from": "events",
      "to": "knowledge",
      "label": "Return persisted acknowledgment",
      "line": "dashed",
      "arrow": "open"
    },
    {
      "type": "message",
      "from": "knowledge",
      "to": "database",
      "label": "Acknowledge provider delivery state only after exact receipt-bound ack validation",
      "line": "solid",
      "arrow": "filled"
    },
    {
      "type": "note",
      "over": ["knowledge", "events"],
      "label": "Failure stays PENDING; caller retry uses fresh same-actor bearer(s). No background worker or token acquisition."
    },
    {
      "type": "note",
      "over": ["knowledge", "events", "eventDatabase"],
      "label": "Project facts have their own sequence and inbox; they never become session/run events or change Sessions provider pins."
    }
  ]
}
